{"agefreighterVersion":"2.4.0-dev.290c6efa3b3e","checks":[{"id":"read-only","status":"pass","summary":"source-only scan; target credentials and quarantine were not used"},{"id":"source-counts","status":"pass","summary":"all configured Cosmos mappings reached EOF during the required immutable-source window"}],"command":"inventory","errors":[],"generatedAt":"2026-09-18T00:25:25.248078194Z","incompleteChecks":[],"outcome":"pass","schemaVersion":1,"sections":[{"fields":[{"name":"estimatedGraphBytesRange","status":"pass","value":"1613436010..3226872020"},{"name":"estimatedIdentityBytesRange","status":"pass","value":"716800000..2150400000"},{"name":"estimatedStagingBytesRange","status":"pass","value":"806718005..1613436010"},{"name":"estimatedTargetRows","status":"pass","value":"5600000"},{"name":"estimatedWALBytesRange","status":"pass","value":"1613436010..6453744040"},{"name":"method","status":"pass","value":"complete-stream-range"},{"name":"recommendedStorageBytesRange","status":"pass","value":"4750390025..13444452070"},{"name":"replacementBackupBytesRange","status":"pass","value":"0..0"},{"name":"replacementShadowBytesRange","status":"pass","value":"0..0"}],"title":"Capacity indicators"},{"fields":[{"name":"edge:CARRIED_BY","status":"pass","value":"350000"},{"name":"edge:CONTAINS","status":"pass","value":"1000000"},{"name":"edge:DESTINED_FOR","status":"pass","value":"350000"},{"name":"edge:FULFILLS","status":"pass","value":"450000"},{"name":"edge:INCLUDED_IN","status":"pass","value":"350000"},{"name":"edge:ORIGINATES_AT","status":"pass","value":"350000"},{"name":"edge:PLACED_WITH","status":"pass","value":"450000"},{"name":"edge:PRODUCED_AT","status":"pass","value":"300000"},{"name":"edge:SUPPLIES","status":"pass","value":"400000"},{"name":"vertex:Carrier","status":"pass","value":"1000"},{"name":"vertex:Customer","status":"pass","value":"29000"},{"name":"vertex:Facility","status":"pass","value":"20000"},{"name":"vertex:Location","status":"pass","value":"10000"},{"name":"vertex:Lot","status":"pass","value":"500000"},{"name":"vertex:Product","status":"pass","value":"200000"},{"name":"vertex:PurchaseOrder","status":"pass","value":"450000"},{"name":"vertex:Shipment","status":"pass","value":"350000"},{"name":"vertex:Supplier","status":"pass","value":"40000"}],"title":"Mapped record counts"},{"fields":[{"name":"connector","status":"pass","value":"cosmos-nosql"},{"name":"countMethod","status":"pass","value":"cosmos-nosql-complete-stream"},{"name":"edges","status":"pass","value":"4000000"},{"name":"mappedRecordBytes","status":"pass","value":"806718005"},{"name":"totalRows","status":"pass","value":"5600000"},{"name":"vertices","status":"pass","value":"1600000"}],"title":"Source inventory"}],"warnings":[{"code":"INVENTORY_NOT_MIGRATION_VERIFICATION","message":"Counts describe mapped records, not unique identities or endpoint existence. Keep the source unchanged until migration verification completes."}]}
